{"receipt_id":"sr_bgrreviewedsource0001","status":"immutable","reviewed_ficha":{"repository_commit":"0000000000000000000000000000000000000000","path":"fixtures-only/no-production-ficha","linkage_state":"pending_canonical_evidence"},"source":{"source_class":"lawful-local-pdf"},"file_sha256":"bf629d4b425db4e842e66a5ed2304a334ca51a6b2ed45b2986517cfa6ec6c7ae","lawful_use_decision":"approved-with-retention-condition","collection":"nanolime","authorized_principal":"aaaaaaaaaaaaaaaaaaaaaaaaaaaaaaaaaaaaaaaaaaaaaaaaaaaaaaaaaaaaaaaa","issued_at":"2026-08-31T00:00:00Z"}
